### ISSUE TITLE
tcp_nodelay option seem to not have any effect

### ISSUE THREAD

**Issue by npliashechnikov** [uperf/uperf#50]
Hello,
I have downloaded and built uperf from source (commit 7959b224b9b3ce653c5f6273d987e18c333216c2) using the included build scripts (configure/make)

I'm using a small packet profile to determine the PPS rate of the system:
```
<?xml version="1.0"?>
<profile name="imix">
    <group nthreads="1" name="small_tcp_packets">
        <transaction iterations="1">
            <flowop type="connect" options="remotehost=$h protocol=tcp tcp_nodelay"/>
        </transaction>
        <transaction duration="$duration" name="small_tcp_packets">
            <flowop type="write" options="size=88"/>
        </transaction>
        <transaction iterations="1">
            <flowop type="disconnect" />
        </transaction>
    </group>
</profile>
```

However, the interface statistics (opkts/s) is not consistent with the number of operations made by uperf.
Attempt to eavesdrop on the interface shows a picture that's very similar to the Nagle algorithm in action:
```
19263 49.743197818 10.123.239.221 → 10.123.239.201 TCP 154 34004 → 39641 [PSH, ACK] Seq=4448137 Ack=1 Win=64256 Len=88 TSval=1074605012 TSecr=3868361606
19264 49.743201772 10.123.239.221 → 10.123.239.201 TCP 242 34004 → 39641 [PSH, ACK] Seq=4448225 Ack=1 Win=64256 Len=176 TSval=1074605012 TSecr=3868361606
19265 49.743206662 10.123.239.221 → 10.123.239.201 TCP 330 34004 → 39641 [PSH, ACK] Seq=4448401 Ack=1 Win=64256 Len=264 TSval=1074605012 TSecr=3868361606
19266 49.743211812 10.123.239.221 → 10.123.239.201 TCP 418 34004 → 39641 [PSH, ACK] Seq=4448665 Ack=1 Win=64256 Len=352 TSval=1074605012 TSecr=3868361606
19267 49.743216726 10.123.239.221 → 10.123.239.201 TCP 506 34004 → 39641 [PSH, ACK] Seq=4449017 Ack=1 Win=64256 Len=440 TSval=1074605012 TSecr=3868361606
19268 49.743222427 10.123.239.221 → 10.123.239.201 TCP 594 34004 → 39641 [PSH, ACK] Seq=4449457 Ack=1 Win=64256 Len=528 TSval=1074605012 TSecr=3868361606
19269 49.743228616 10.123.239.221 → 10.123.239.201 TCP 682 34004 → 39641 [PSH, ACK] Seq=4449985 Ack=1 Win=64256 Len=616 TSval=1074605012 TSecr=3868361606
19270 49.743234962 10.123.239.221 → 10.123.239.201 TCP 682 34004 → 39641 [PSH, ACK] Seq=4450601 Ack=1 Win=64256 Len=616 TSval=1074605012 TSecr=3868361606
```

Could anyone please suggest what is wrong with the config? I tried reproducing the results with the latest iperf3, but with it, the packet size in pcap stays exactly the same as the MSS I have specified.

**Comment by npliashechnikov** [comment]
So far I have tried removing the TCP_NODELAY condition in generic.c, but it didn't have any effect. Uperf keeps sending larger TCP packets according to the PCAP captures.

**Comment by realneel** [comment]
@npliashechnikov thanks for reporting. The code for setting TCP_NODELAY has not changed in a very long time. uperf just sets the option on the socket. Can you verify with `strace` that the option is set using setsockopt?


BTW what OS/Version are you seeing this on?

**Comment by tuexen** [comment]
In the tracefile you showed, there are no ACKs. So if there are actually no acknowledgements, this trace is fine, if the Nagle algorithm is disabled. Please note, that TCP is a bytestream protocol, so there is no intention to keep the boundaries of the send calls.
